{
  "selected_recipe": "project-memory-capture",
  "memory_candidates": [
    {
      "id": "provider-selection-not-invocation",
      "type": "workflow",
      "title": "Provider selection is not provider invocation",
      "summary": "When YAML policy selects a provider, think-tank must still mark that provider as not_invoked until a real dispatch, invocation, and recovery path runs.",
      "source": {
        "files": [
          "think-tank/examples/platforms/codex/codex-provider-invocation-matrix.json",
          "think-tank/docs/codex-runtime-verification-matrix.md"
        ],
        "commands": [
          "python3 checks/codex_runtime_verification_matrix_check.py"
        ],
        "discussions": []
      },
      "verified_at": "2026-05-15",
      "scope": "repo",
      "privacy": "project_local",
      "status": "active",
      "staleness_risk": "low",
      "expires_when": "User changes the project policy model or provider invocation contract.",
      "review_after": null,
      "refresh_trigger": [
        "Before changing provider policy runtime semantics.",
        "When provider invocation matrix or routing checks change."
      ],
      "confidence": "high",
      "target": ".think-tank/memory/workflows.md",
      "action": "append",
      "quality_check": {
        "has_source": true,
        "has_scope": true,
        "has_privacy_label": true,
        "has_staleness_risk": true,
        "has_expiry_rule": true,
        "no_secret": true,
        "no_unverified_claim_as_fact": true,
        "no_duplicate": true
      }
    }
  ],
  "written": [],
  "skipped": [],
  "boundaries": [
    "This sample proposes local project memory only.",
    "It does not write to public think-tank core files by default."
  ]
}
